{
    "id": "urn:ngsi-ld:ConsumptionBehaviour:VC17",
    "type": "ConsumptionBehaviour",
    "resourceType": "Diesel",
    "sourceOfConsumption": "urn:ngsi-ld:Vehicle:VC0001",
    "startDate": "2018-09-21T12:00:00Z",
    "endDate": "2018-09-21T12:00:00Z",
    "initialMeasurement": 455555,
    "finalMeasurement": 456123,
    "usersInvolved": 2
}
